product_id,product_name,product_company,product_flavour,category,product_size,product_price,product_rate,one_star,two_star,three_star,four_star,five_star,reviews_number,product_quality
58592,"Gustus Vitae, Gourmet Salt, Natural Smoked Sea Salt, 3 oz (84 g)",Gustus Vitae," Gourmet Salt, Natural Smoked Sea Salt,", Herb and Spices,84 g,14.15,4.2,7,8,16,20,83,134,excellent
35883,"Frontier Natural Products, Organic Onion Powder, 2.10 oz (59 g)",Frontier Natural Products," Organic Onion Powder,", Herb and Spices,59 g,7.46,4.6,2,1,7,7,74,91,excellent
22503,"Starwest Botanicals, Organic, Basil Leaf C/S , 1 lb (453.6 g)",Starwest Botanicals," Organic, Basil Leaf C/S ,", Herb and Spices,453,20.12,4.5,1,4,3,10,43,61,excellent
31081,"Frontier Natural Products, Organic Powdered Ginger Root, 16 oz (453 g)",Frontier Natural Products," Organic Powdered Ginger Root,", Herb and Spices,453 g,34.6,4.7,0,1,3,9,40,53,excellent
30921,"Frontier Natural Products, Organic Cut & Sifted Mediterranean Oregano Leaf, 16 oz (453 g)",Frontier Natural Products," Organic Cut & Sifted Mediterranean Oregano Leaf,", Herb and Spices,453 g,22.73,4.8,0,1,1,4,32,38,excellent
40279,"Starwest Botanicals, Organic Nigella Seeds, 1 lb",Starwest Botanicals," Organic Nigella Seeds,", Herb and Spices,1 ,17.84,4.4,3,0,2,2,21,28,excellent
30942,"Frontier Natural Products, Organic Whole Cardamom Pods, 16 oz (453 g)",Frontier Natural Products," Organic Whole Cardamom Pods,", Herb and Spices,453 g,62.37,4.6,2,0,2,2,28,34,excellent
31146,"Frontier Natural Products, Organic Whole Star Anise Select, 16 oz (453 g)",Frontier Natural Products," Organic Whole Star Anise Select,", Herb and Spices,453 g,23.77,4.5,6,2,1,11,60,80,excellent
94931,"Frontier Natural Products, Ground Sumac, 2.10 oz (59 g)",Frontier Natural Products," Ground Sumac,", Herb and Spices,59 g,6.86,4.8,0,0,0,2,8,10,excellent
30996,"Frontier Natural Products, Organic Whole Bay Leaf, 16 oz (453 g)",Frontier Natural Products," Organic Whole Bay Leaf,", Herb and Spices,453 g,28.94,4.6,1,2,2,4,42,51,excellent
30687,"Frontier Natural Products, Four Pepper Blend Gourmet Peppermill, 16 oz (453 g)",Frontier Natural Products," Four Pepper Blend Gourmet Peppermill,", Herb and Spices,453 g,33.89,4.8,0,0,2,2,27,31,excellent
22592,"Starwest Botanicals, Organic Whole Pepper Black Malabar, 1 lb (453.6 g)",Starwest Botanicals," Organic Whole Pepper Black Malabar,", Herb and Spices,453,25.74,4.8,0,0,2,2,20,24,excellent
58595,"Gustus Vitae, Gourmet Salt, Italian Black Truffle Sea Salt, 2.8 oz (76 g)",Gustus Vitae," Gourmet Salt, Italian Black Truffle Sea Salt,", Herb and Spices,76 g,28.32,3.1,30,8,14,11,32,95,good
30919,"Frontier Natural Products, Organic Chili Powder Blend, 16 oz (453 g)",Frontier Natural Products," Organic Chili Powder Blend,", Herb and Spices,453 g,22.62,4.3,2,0,1,0,11,14,excellent
30969,"Frontier Natural Products, Organic Whole Fenugreek Seed, 16 oz (453 g)",Frontier Natural Products," Organic Whole Fenugreek Seed,", Herb and Spices,453 g,14.15,4.1,8,4,3,6,44,65,excellent
30984,"Frontier Natural Products, Organic Rubbed Sage Leaf, 16 oz (453 g)",Frontier Natural Products," Organic Rubbed Sage Leaf,", Herb and Spices,453 g,26.86,4.2,2,2,0,1,13,18,excellent
30707,"Frontier Natural Products, Powdered Garlic, 16 oz (453 g)",Frontier Natural Products," Powdered Garlic,", Herb and Spices,453 g,20.06,4.5,3,1,1,10,38,53,excellent
31159,"Frontier Natural Products, Organic Cut & Sifted Orange Peel, 16 oz (453 g)",Frontier Natural Products," Organic Cut & Sifted Orange Peel,", Herb and Spices,453 g,21.71,3.9,7,6,9,18,33,73,good
30724,"Frontier Natural Products, Taco Seasoning, 16 oz (453 g)",Frontier Natural Products," Taco Seasoning,", Herb and Spices,453 g,16.34,4.6,10,8,30,58,306,412,excellent
94949,"Simply Organic, Savory Seasoning, Salt-Free, 2.00 oz (57 g)",Simply Organic," Savory Seasoning, Salt-Free,", Herb and Spices,57 g,7.9,4.6,0,0,0,3,4,7,excellent
19134,"Source Naturals, Crystal Balance, Himalayan Rock Salt, Fine Grind, 12 oz (340 g)",Source Naturals," Crystal Balance, Himalayan Rock Salt, Fine Grind,", Herb and Spices,340 g,16.95,4.6,3,0,6,12,69,90,excellent
22575,"Starwest Botanicals, Organic Lavender Flowers Extra, 1 lb (453.6 g)",Starwest Botanicals," Organic Lavender Flowers Extra,", Herb and Spices,453,32.04,3.9,10,8,9,11,48,86,good
30689,"Frontier Natural Products, Whole Black Peppercorns, 16 oz (453 g)",Frontier Natural Products," Whole Black Peppercorns,", Herb and Spices,453 g,22.32,4.8,0,1,2,4,45,52,excellent
31010,"Frontier Natural Products, Organic Granulated White Onion, 16 oz (453 g)",Frontier Natural Products," Organic Granulated White Onion,", Herb and Spices,453 g,20.56,5.0,0,0,0,0,10,10,excellent
30914,"Frontier Natural Products, Organic Ground Cumin Seed, 16 oz (453 g)",Frontier Natural Products," Organic Ground Cumin Seed,", Herb and Spices,453 g,21.9,4.6,0,2,1,2,22,27,excellent
31086,"Frontier Natural Products, Organic Fine Grind Black Pepper, 16 oz (453 g)",Frontier Natural Products," Organic Fine Grind Black Pepper,", Herb and Spices,453 g,31.22,4.8,0,0,1,3,22,26,excellent
30727,"Frontier Natural Products, Whole Black Peppercorns Tellicherry, 16 oz (453 g)",Frontier Natural Products," Whole Black Peppercorns Tellicherry,", Herb and Spices,453 g,24.79,5.0,0,0,0,0,22,22,excellent
35889,"Frontier Natural Products, Organic Cardamom Seed, Whole, 2.68 oz (76 g)",Frontier Natural Products," Organic Cardamom Seed, Whole,", Herb and Spices,76 g,15.4,4.7,1,0,5,7,56,69,excellent
35490,"Frontier Natural Products, Pink Peppercorns, 0.88 oz (25 g)",Frontier Natural Products," Pink Peppercorns,", Herb and Spices,25 g,10.45,4.0,4,6,5,12,27,54,excellent
73482,"Simply Organic, Organic, Ancho Chili Powder, 2.85 oz (81 g)",Simply Organic," Organic, Ancho Chili Powder,", Herb and Spices,81 g,11.05,4.6,2,0,0,1,18,21,excellent
30943,"Frontier Natural Products, Organic Whole Cloves, 16 oz (453 g)",Frontier Natural Products," Organic Whole Cloves,", Herb and Spices,453 g,52.71,4.5,4,0,2,7,39,52,excellent
30800,"Frontier Natural Products, Popcorn Seasoning, Cheddar & Spice, 16 oz (453 g)",Frontier Natural Products," Popcorn Seasoning, Cheddar & Spice,", Herb and Spices,453 g,22.73,4.3,4,3,7,15,46,75,excellent
30857,"Frontier Natural Products, All-Purpose Seasoning, Salt Free, 16 oz (453 g)",Frontier Natural Products," All-Purpose Seasoning, Salt Free,", Herb and Spices,453 g,20.13,4.6,6,5,22,43,240,316,excellent
31164,"Frontier Natural Products, Organic Pickling Spice, 16 oz (453 g)",Frontier Natural Products," Organic Pickling Spice,", Herb and Spices,453 g,20.13,4.7,0,1,0,5,24,30,excellent
88626,"True Citrus, True Lemon, Crystallized Lemon Pepper, Salt-Free, 2.12 oz (60 g)",True Citrus," True Lemon, Crystallized Lemon Pepper, Salt-Free,", Herb and Spices,60 g,8.64,4.3,0,1,0,1,4,6,excellent
94927,"Frontier Natural Products, Sumac Berries Ground, 16 oz (453 g)",Frontier Natural Products," Sumac Berries Ground,", Herb and Spices,453 g,24.79,5.0,0,0,0,0,1,1,excellent
94951,"Simply Organic, Citrus Seasoning, Salt-Free, 2.20 oz (63 g)",Simply Organic," Citrus Seasoning, Salt-Free,", Herb and Spices,63 g,7.9,5.0,0,0,0,0,2,2,excellent
98031,"Simply Organic, Baking Essentials, Organic Spice Kit, Variety Pack, 4 Spices",Simply Organic," Baking Essentials, Organic Spice Kit, Variety Pack,", Herb and Spices,4 ,33.77,5.0,0,0,0,0,1,1,excellent
86539,"Saffronia , Dill Weed, 6 oz",Saffronia ," Dill Weed,", Herb and Spices,6 ,12.31,4.2,1,0,0,0,4,5,excellent
80845,"Frontier Natural Products, Organic Kale Powder, 16 oz (453 g)",Frontier Natural Products," Organic Kale Powder,", Herb and Spices,453 g,50.01,3.0,1,1,0,1,1,4,good
30973,"Frontier Natural Products, Organic Three Pepper Blend Gourmet Peppermill, 16 oz (453 g)",Frontier Natural Products," Organic Three Pepper Blend Gourmet Peppermill,", Herb and Spices,453 g,39.07,4.8,0,0,2,2,20,24,excellent
30743,"Frontier Natural Products, Parsley Leaf Flakes, 16 oz (453 g)",Frontier Natural Products," Parsley Leaf Flakes,", Herb and Spices,453 g,31.11,4.4,2,1,8,12,40,63,excellent
30779,"Frontier Natural Products, Ground Chipotle Chili Peppers, 16 oz (453 g)",Frontier Natural Products," Ground Chipotle Chili Peppers,", Herb and Spices,453 g,25.85,4.8,1,1,3,6,78,89,excellent
99216,"Zatarain's, Crawfish, Shrimp, & Crab Boil in Bag, 3 oz (85 g)",Zatarain's," Crawfish, Shrimp, & Crab Boil in Bag,", Herb and Spices,85 g,3.15,5.0,0,0,0,0,1,1,excellent
94947,"Simply Organic, Spicy Seasoning, Salt-Free, 2.40 oz (69 g)",Simply Organic," Spicy Seasoning, Salt-Free,", Herb and Spices,69 g,7.9,4.8,0,0,0,1,4,5,excellent
31193,"Frontier Natural Products, Organic Cut Cinnamon Chips, 1/4 - 1/2"", 16 oz (453 g)",Frontier Natural Products," Organic Cut Cinnamon Chips, 1/4 - 1/2"",", Herb and Spices,453 g,15.79,4.5,1,1,2,6,26,36,excellent
30856,"Frontier Natural Products, Mild Cheddar Cheese Powder, 16 oz (453 g)",Frontier Natural Products," Mild Cheddar Cheese Powder,", Herb and Spices,453 g,24.2,3.6,5,8,3,7,19,42,good
43043,"Starwest Botanicals, Sandalwood Red Powder, 1 lb (453.6 g)",Starwest Botanicals," Sandalwood Red Powder,", Herb and Spices,453,27.41,3.9,2,3,0,2,10,17,good
99207,"McCormick Gourmet Global Selects, Oak Wood Smoked Pepper From Vietnam,  1.76 oz (49 g)",McCormick Gourmet Global Selects," Oak Wood Smoked Pepper From Vietnam,", Herb and Spices,49 g,10.55,4.5,0,0,0,1,1,2,excellent
86540,"Saffronia , Mint Leaves, 6 oz ",Saffronia ," Mint Leaves,", Herb and Spices,6 ,11.78,4.5,0,0,0,2,2,4,excellent
30864,"Frontier Natural Products, Whole Chipotle Chili Peppers, 75,000 Heat Units, 16 oz (453 g)",Frontier Natural Products," Whole Chipotle Chili Peppers, 75,000 Heat Units,", Herb and Spices,453 g,24.79,4.6,2,0,0,7,31,40,excellent
36194,"Aloha Bay, Salt Mill, with Adjustable Ceramic Grinder, 3.5 oz (100 g)",Aloha Bay," Salt Mill, with Adjustable Ceramic Grinder,", Herb and Spices,100 g,23.03,4.5,7,3,3,11,92,116,excellent
87182,"Pure Indian Foods, Organic Garam Masala, Whole DIY, 8 oz (226 g)",Pure Indian Foods," Organic Garam Masala, Whole DIY,", Herb and Spices,226 g,24.56,3.0,0,0,1,0,0,1,good
99198,"McCormick Gourmet Global Selects, Szechuan Pepper Salt & Spice Blend, 1.05 oz (29 g)",McCormick Gourmet Global Selects," Szechuan Pepper Salt & Spice Blend,", Herb and Spices,29 g,10.55,1.0,1,0,0,0,0,1,poor
86542,"Saffronia , Parsley, 6 oz",Saffronia ," Parsley,", Herb and Spices,6 ,12.31,4.3,0,0,1,0,2,3,excellent
94926,"Frontier Natural Products, Certified Organic Mama Garlic Blend, 16 oz (453 g)",Frontier Natural Products," Certified Organic Mama Garlic Blend,", Herb and Spices,453 g,22.04,1.0,1,0,0,0,0,1,poor
80843,"Frontier Natural Products, Organic Whole Aronia Berries, 16 oz (453 g)",Frontier Natural Products," Organic Whole Aronia Berries,", Herb and Spices,453 g,39.26,1.0,2,0,0,0,0,2,poor
89208,"Gustus Vitae, Gourmet Spice, Granulated Garlic, 2.2 oz (62 g)",Gustus Vitae," Gourmet Spice, Granulated Garlic,", Herb and Spices,62 g,15.73,5.0,0,0,0,0,1,1,excellent
86532,"Saffronia , Premium Saffron, 0.035 oz (1 g)",Saffronia ," Premium Saffron,", Herb and Spices,1 g,20.07,3.3,1,0,0,1,1,3,good
86537,"Saffronia , Dried Leek, 6 oz",Saffronia ," Dried Leek,", Herb and Spices,6 ,12.31,5.0,0,0,0,0,1,1,excellent
94945,"Simply Organic, Spanish Saffron, 0.018 oz (0.5 g)",Simply Organic," Spanish Saffron,", Herb and Spices,0,21.54,1.8,2,1,1,0,0,4,poor
99202,"McCormick Gourmet Global Selects, Timut Pepper From Nepal,  0.63 oz (17 g)",McCormick Gourmet Global Selects," Timut Pepper From Nepal,", Herb and Spices,17 g,10.55,3.0,0,0,1,0,0,1,good
12126,"Eden Foods, Eden Shake, Sesame and Sea Vegetable Seasoning, 2.1 oz (60 g)  ",Eden Foods," Eden Shake, Sesame and Sea Vegetable Seasoning,", Herb and Spices,60 g,not availabe,4.6,2,2,2,4,46,56,excellent
35878,"Frontier Natural Products, Organic Orange Peel, Granules, 1.92 oz (54 g)  ",Frontier Natural Products," Organic Orange Peel, Granules,", Herb and Spices,54 g,not availabe,3.9,7,6,9,18,33,73,good
31504,"Simply Organic, Spicy Taco Seasoning, 12 Packets, 1.13 oz (32 g) Each  ",Simply Organic," Spicy Taco Seasoning, 12 Packets,", Herb and Spices,32 g,not availabe,4.8,0,0,0,3,16,19,excellent
81700,"Himalania, Himalayan Fine Pink Salt, 6 oz (170 g)  ",Himalania," Himalayan Fine Pink Salt,", Herb and Spices,170 g,not availabe,4.7,0,0,0,3,6,9,excellent
80149,"Gustus Vitae, Gourmet Seasoning, Taste of Cajun, 10 oz (283 g)",Gustus Vitae," Gourmet Seasoning, Taste of Cajun,", Herb and Spices,283 g,31.47,4.5,0,1,2,5,14,22,excellent
79299,"Pure Indian Foods, Organic Turmeric Root, Ground, 2.3 oz (65 g)  ",Pure Indian Foods," Organic Turmeric Root, Ground,", Herb and Spices,65 g,not availabe,4.8,0,0,0,1,5,6,excellent
79299,"Pure Indian Foods, Organic Turmeric Root, Ground, 2.3 oz (65 g)  ",Pure Indian Foods," Organic Turmeric Root, Ground,", Herb and Spices,65 g,not availabe,4.8,0,0,0,1,5,6,excellent
82543,"Terrasoul Superfoods, Turmeric Powder, 16 oz (454 g)  ",Terrasoul Superfoods," Turmeric Powder,", Herb and Spices,454 g,not availabe,4.6,0,0,1,3,9,13,excellent
82779,"Frontier Natural Products, Organic Turmeric Twist, Daily Blend, 1.80 oz (51 g)  ",Frontier Natural Products," Organic Turmeric Twist, Daily Blend,", Herb and Spices,51 g,not availabe,4.0,0,0,1,1,1,3,excellent
82780,"Frontier Natural Products, Organic Turmeric Twist, Sweet Blend, 1.80 oz (51 g)  ",Frontier Natural Products," Organic Turmeric Twist, Sweet Blend,", Herb and Spices,51 g,not availabe,5.0,0,0,0,0,4,4,excellent
84010,"Gustus Vitae, Gourmet Seasoning Dry Rub, Pacific Seafood Seasoning, 2.3 oz (65 g)",Gustus Vitae," Gourmet Seasoning Dry Rub, Pacific Seafood Seasoning,", Herb and Spices,65 g,14.15,4.0,0,0,1,1,1,3,excellent
84011,"Gustus Vitae, Gourmet Seasoning Dry Rub, Smoked Espresso Sea Salt, 2.3 oz (65 g)  ",Gustus Vitae," Gourmet Seasoning Dry Rub, Smoked Espresso Sea Salt,", Herb and Spices,65 g,not availabe,1.0,3,0,0,0,0,3,poor
86538,"Saffronia , Dried Lemon, 6 oz",Saffronia ," Dried Lemon,", Herb and Spices,6 ,11.78,5.0,0,0,0,0,3,3,excellent
79303,"Pure Indian Foods, Organic Kitchari Spice Mix, Ground, 2.4 oz (68 g)  ",Pure Indian Foods," Organic Kitchari Spice Mix, Ground,", Herb and Spices,68 g,not availabe,4.6,0,0,0,2,3,5,excellent
30764,"Frontier Natural Products, Cajun Seasoning, 16 oz (453 g)  ",Frontier Natural Products," Cajun Seasoning,", Herb and Spices,453 g,not availabe,4.5,4,6,24,34,169,237,excellent
30815,"Frontier Natural Products, Whole Coriander Seed, 16 oz (453 g)  ",Frontier Natural Products," Whole Coriander Seed,", Herb and Spices,453 g,not availabe,4.3,3,0,0,1,15,19,excellent
31348,"Simply Organic, Cayenne, 2.89 oz (82 g)",Simply Organic," Cayenne,", Herb and Spices,82 g,6.99,4.8,7,4,23,63,510,607,excellent
31453,"Simply Organic, Crushed Red Pepper, 1.59 oz (45 g)",Simply Organic," Crushed Red Pepper,", Herb and Spices,45 g,6.85,4.4,11,17,43,74,255,400,excellent
35790,"Frontier Natural Products, Organic Vanilla Extract, Indonesia, Farm Grown , 2 fl oz (59 ml)",Frontier Natural Products," Organic Vanilla Extract, Indonesia, Farm Grown ,", Herb and Spices,59 ,18.32,3.7,16,6,8,15,40,85,good
31428,"Simply Organic, Ground Nutmeg, 2.30 oz (65 g)",Simply Organic," Ground Nutmeg,", Herb and Spices,65 g,10.45,4.5,9,5,13,19,141,187,excellent
31470,"Simply Organic, Adjustable Grinder Cap, Chophouse Seasoning, 3.81 oz (108 g)",Simply Organic," Adjustable Grinder Cap, Chophouse Seasoning,", Herb and Spices,108 g,9.92,4.5,3,3,8,25,91,130,excellent
29795,"Eden Foods, Sea Salt, 14 oz (397 g)",Eden Foods," Sea Salt,", Herb and Spices,397 g,13.37,4.4,4,1,1,10,37,53,excellent
22596,"Starwest Botanicals, Rosehips Powder, Organic, 1 lb (453.6 g)",Starwest Botanicals," Rosehips Powder, Organic,", Herb and Spices,453,25.4,4.5,6,1,16,32,119,174,excellent
31475,"Simply Organic, Grind to a Salt Blend, 4.76 oz (135 g)",Simply Organic," Grind to a Salt Blend,", Herb and Spices,135 g,9.97,4.5,14,3,20,41,220,298,excellent
31471,"Simply Organic, Citrus A'Peel, 2.54 oz (72 g)",Simply Organic," Citrus A'Peel,", Herb and Spices,72 g,9.97,4.3,1,8,13,27,62,111,excellent
46440,"Frontier Natural Products, Alder Smoked Salt, Gourmet Salt Grinder, 3.17 oz (90 g)",Frontier Natural Products," Alder Smoked Salt, Gourmet Salt Grinder,", Herb and Spices,90 g,8.88,4.3,5,8,0,8,56,77,excellent
46440,"Frontier Natural Products, Alder Smoked Salt, Gourmet Salt Grinder, 3.17 oz (90 g)",Frontier Natural Products," Alder Smoked Salt, Gourmet Salt Grinder,", Herb and Spices,90 g,8.88,4.3,5,8,0,8,56,77,excellent
94932,"Frontier Natural Products, Za'atar Seasoning, 1.90 oz (55 g)",Frontier Natural Products," Za'atar Seasoning,", Herb and Spices,55 g,9.89,4.8,0,0,0,1,4,5,excellent
99193,"Old Bay, Seasoning, 2.62 oz (74 g)",Old Bay," Seasoning,", Herb and Spices,74 g,4.91,5.0,0,0,0,0,1,1,excellent
31016,"Frontier Natural Products, Organic Minced Garlic, 16 oz (453 g)",Frontier Natural Products," Organic Minced Garlic,", Herb and Spices,453 g,24.28,4.4,4,1,0,4,30,39,excellent
86241,"Kevala, Organic Turmeric Root Powder, 16 oz (454 g)",Kevala," Organic Turmeric Root Powder,", Herb and Spices,454 g,13.18,4.6,1,0,0,0,8,9,excellent
33500,"Knorr, French Onion Recipe Mix, 1.4 oz (40 g)",Knorr," French Onion Recipe Mix,", Herb and Spices,40 g,3.15,4.4,1,0,3,1,15,20,excellent
99190,"McCormick, Organic Brown Gravy Mix, 0.87 oz (24 g)",McCormick," Organic Brown Gravy Mix,", Herb and Spices,24 g,3.15,1.0,1,0,0,0,0,1,poor
50193,"Himalania, Fine Pink Salt, 10 oz (285 g)",Himalania," Fine Pink Salt,", Herb and Spices,285 g,13.92,3.8,5,0,2,6,13,26,good
31013,"Frontier Natural Products, Organic Whole Black Peppercorns Tellicherry, 16 oz (453 g)",Frontier Natural Products," Organic Whole Black Peppercorns Tellicherry,", Herb and Spices,453 g,29.97,4.7,0,1,3,14,53,71,excellent
22550,"Starwest Botanicals, Organic Cumin Seed, 1 lb (453.6 g)",Starwest Botanicals," Organic Cumin Seed,", Herb and Spices,453,21.13,4.8,0,0,0,3,14,17,excellent
94942,"Simply Organic, Spicy Curry Powder, 2.80 oz (79 g)",Simply Organic," Spicy Curry Powder,", Herb and Spices,79 g,8.01,4.7,0,0,0,2,4,6,excellent
35913,"Frontier Natural Products, Indian Curry Seasoning, 1.87 oz (53 g)",Frontier Natural Products," Indian Curry Seasoning,", Herb and Spices,53 g,5.9,4.6,3,1,2,16,68,90,excellent
86536,"Saffronia , Fenugreek Leaves, 6 oz",Saffronia ," Fenugreek Leaves,", Herb and Spices,6 ,14.18,4.7,0,0,0,1,2,3,excellent
75398,"Source Naturals, Black Seed Oil, 120 Softgels",Source Naturals," Black Seed Oil,", Herb and Spices,120 ,17.58,3.8,3,2,2,0,12,19,good
30842,"Frontier Natural Products, Popcorn Seasoning, Cheddar Cheese, 16 oz (453 g)",Frontier Natural Products," Popcorn Seasoning, Cheddar Cheese,", Herb and Spices,453 g,21.71,3.7,14,4,10,19,35,82,good
31478,"Simply Organic, French Onion Dip Mix, 12 Packets, 1.10 oz (31 g) Each",Simply Organic," French Onion Dip Mix, 12 Packets,", Herb and Spices,31 g,25.38,4.8,1,0,1,4,37,43,excellent
57979,"Bob's Red Mill, Honey Oat Granola, Gluten Free, 12 oz (340 g)",Bob's Red Mill," Honey Oat Granola, Gluten Free,", Breakfast,340 g,8.8,4.1,28,16,36,59,196,335,excellent
77538,"Julian Bakery, Pro Granola, Vanilla Cinnamon Cluster, 1.22 lbs (555 g)",Julian Bakery," Pro Granola, Vanilla Cinnamon Cluster,", Breakfast,555 g,22.02,3.7,119,45,54,84,337,639,good
75280,"Simple Mills, Naturally Gluten-Free, Almond Flour Mix, Pancake & Waffle, 10.7 oz (303 g)",Simple Mills," Naturally Gluten-Free, Almond Flour Mix, Pancake & Waffle,", Breakfast,303 g,12.07,4.3,6,10,12,23,94,145,excellent
82441,"Gerber, Lil' Bits, Oatmeal Cereal,  8+ Months, Banana Strawberry, 8 oz (227 g)",Gerber," Lil' Bits, Oatmeal Cereal,  8+ Months, Banana Strawberry,", Breakfast,227 g,7.38,4.1,9,2,6,13,45,75,excellent
25961,"Earth's Best, Organic Whole Grain Oatmeal Cereal, 8 oz (227 g)",Earth's Best," Organic Whole Grain Oatmeal Cereal,", Breakfast,227 g,6.9,4.2,92,20,35,88,491,726,excellent
89521,"Bob's Red Mill, Quick Cooking Rolled Oats, Whole Grain, Gluten Free, 28 oz (794 g)",Bob's Red Mill," Quick Cooking Rolled Oats, Whole Grain, Gluten Free,", Breakfast,794 g,15.38,4.7,7,4,9,26,234,280,excellent
89521,"Bob's Red Mill, Quick Cooking Rolled Oats, Whole Grain, Gluten Free, 28 oz (794 g)",Bob's Red Mill," Quick Cooking Rolled Oats, Whole Grain, Gluten Free,", Breakfast,794 g,15.38,4.7,7,4,9,26,234,280,excellent
82439,"Gerber, Hearty Bits, MultiGrain Cereal, 12+ Months, Banana, Apple, Strawberry, 8 oz (227 g)",Gerber," Hearty Bits, MultiGrain Cereal, 12+ Months, Banana, Apple, Strawberry,", Breakfast,227 g,7.38,4.7,2,1,4,3,59,69,excellent
71820,"FlapJacked, Pancake and Baking Mix, Gluten-Free, Buttermilk, 24 oz (680 g)",FlapJacked," Pancake and Baking Mix, Gluten-Free, Buttermilk,", Breakfast,680 g,20.45,4.1,17,15,23,55,133,243,excellent
48867,"Gerber, DHA & Probiotic, Single Grain Rice Cereal, 8 oz (227 g)",Gerber," DHA & Probiotic, Single Grain Rice Cereal,", Breakfast,227 g,8.23,4.4,32,8,19,49,278,386,excellent
48865,"Gerber, Rice Cereal, Single Grain, 8 oz (227 g)",Gerber," Rice Cereal, Single Grain,", Breakfast,227 g,6.28,4.5,22,12,21,62,317,434,excellent
88364,"Julian Bakery, Pro Granola, Peanut Butter Cluster, 1.16 lbs (526 g)",Julian Bakery," Pro Granola, Peanut Butter Cluster,", Breakfast,526 g,22.02,4.3,4,1,5,6,31,47,excellent
82443,"Gerber, Lil' Bits, Whole Wheat Cereal,  8+ Months, Apple Blueberry, 8 oz (227 g)",Gerber," Lil' Bits, Whole Wheat Cereal,  8+ Months, Apple Blueberry,", Breakfast,227 g,7.38,4.3,3,1,7,2,31,44,excellent
84617,"General Mills, Honey Nut Cheerios, 10.8 oz (306 g)",General Mills," Honey Nut Cheerios,", Breakfast,306 g,8.47,4.5,10,10,23,50,242,335,excellent
86632,"Julian Bakery, Pro Granola, Espresso Cluster, 17.9 oz (510 g)",Julian Bakery," Pro Granola, Espresso Cluster,", Breakfast,510 g,24.23,4.3,3,1,4,8,29,45,excellent
32204,"Cascadian Farm, Organic, Granola, Dark Chocolate Almond, 13.25 oz (375 g)",Cascadian Farm," Organic, Granola, Dark Chocolate Almond,", Breakfast,375 g,8.52,4.2,24,39,69,141,373,646,excellent
81390,"Happy Family Organics,  Clearly Crafted, Oats & Quinoa Baby Cereal, 7 oz (198 g)",Happy Family Organics,"  Clearly Crafted, Oats & Quinoa Baby Cereal,", Breakfast,198 g,6.19,4.5,4,0,0,4,31,39,excellent
25211,"Happy Family Organics, Organic Probiotic Baby Cereal, Multi-Grain, 7 oz (198 g)  ",Happy Family Organics," Organic Probiotic Baby Cereal, Multi-Grain,", Breakfast,198 g,not availabe,4.4,55,22,43,111,617,848,excellent
90949,"Gerber, Organic Oatmeal Cereal, Banana , 8 oz (227 g)",Gerber," Organic Oatmeal Cereal, Banana ,", Breakfast,227 g,8.47,4.7,0,0,0,4,8,12,excellent
58797,"General Mills, Cheerios, 12 oz (340 g)",General Mills," Cheerios,", Breakfast,340 g,10.12,4.3,9,6,13,16,99,143,excellent
89514,"Bob's Red Mill, Steel Cut Oats, Whole Grain, Gluten Free, 24 oz (680 g)",Bob's Red Mill," Steel Cut Oats, Whole Grain, Gluten Free,", Breakfast,680 g,11.29,4.8,1,0,2,8,64,75,excellent
25959,"Earth's Best, Organic Whole Grain Multi-Grain Cereal, 8 oz (227 g)",Earth's Best," Organic Whole Grain Multi-Grain Cereal,", Breakfast,227 g,6.9,4.3,35,11,22,37,273,378,excellent
11792,"Bob's Red Mill, Muesli, Old County Style, Whole Grain, 18 oz (510 g)",Bob's Red Mill," Muesli, Old County Style, Whole Grain,", Breakfast,510 g,8.77,4.5,24,14,62,130,565,795,excellent
61777,"Nature's Path, Love Crunch, Premium Organic Granola, Dark Chocolate & Red Berries, 11.5 oz (325 g)",Nature's Path," Love Crunch, Premium Organic Granola, Dark Chocolate & Red Berries,", Breakfast,325 g,7.86,4.3,85,88,125,330,1182,1810,excellent
48866,"Gerber, Whole Wheat Cereal, 8 oz (227 g)",Gerber," Whole Wheat Cereal,", Breakfast,227 g,6.28,4.3,12,3,5,10,81,111,excellent
77459,"Bob's Red Mill, Oatmeal, Apple Pieces and Cinnamon, 2.36 oz (67 g)",Bob's Red Mill," Oatmeal, Apple Pieces and Cinnamon,", Breakfast,67 g,3.92,4.1,7,1,2,7,28,45,excellent
48870,"Gerber, Organic Oatmeal, Single Grain Cereal, 8 oz (227 g)",Gerber," Organic Oatmeal, Single Grain Cereal,", Breakfast,227 g,7.48,4.4,7,3,8,26,98,142,excellent
54819,"Arrowhead Mills, Organic Sprouted, Corn Flakes, Gluten Free, 10 oz (283 g)",Arrowhead Mills," Organic Sprouted, Corn Flakes, Gluten Free,", Breakfast,283 g,8.31,3.8,8,5,5,10,26,54,good
46451,"Bob's Red Mill, Muesli, Gluten Free, 16 oz (453 g)",Bob's Red Mill," Muesli, Gluten Free,", Breakfast,453 g,9.74,4.3,2,4,25,40,97,168,excellent
21636,"Atkins, Snack, Peanut Butter Fudge Crisp Bar, 5 Bars, 1.2 oz (35 g) Each",Atkins," Snack, Peanut Butter Fudge Crisp Bar, 5 Bars,", Breakfast,35 g,13.78,4.2,17,12,37,77,161,304,excellent
90950,"Gerber, Organic Oatmeal Cereal, Millet Quinoa, 8 oz (227 g)",Gerber," Organic Oatmeal Cereal, Millet Quinoa,", Breakfast,227 g,8.47,4.4,1,1,2,4,19,27,excellent
79536,"Bob's Red Mill, Organic Oatmeal Cup, Classic with Flax & Chia, 1.8 oz (51 g)",Bob's Red Mill," Organic Oatmeal Cup, Classic with Flax & Chia,", Breakfast,51 g,3.92,4.4,1,0,1,3,9,14,excellent
44692,"Kashi, GoLean, Toasted Berry Crisp Cereal, 14 oz (397 g)",Kashi," GoLean, Toasted Berry Crisp Cereal,", Breakfast,397 g,8.19,4.2,15,16,52,76,195,354,excellent
81389,"Happy Family Organics, Clearly Crafted, Oatmeal Baby Cereal, 7 oz (198 g) ",Happy Family Organics," Clearly Crafted, Oatmeal Baby Cereal,", Breakfast,198 g,6.19,3.0,1,1,3,1,1,7,good
32205,"Cascadian Farm, Organic, Granola, Fruit and Nut, 13.5 oz (382 g)",Cascadian Farm," Organic, Granola, Fruit and Nut,", Breakfast,382 g,8.52,4.2,7,3,8,17,50,85,excellent
90951,"Gerber, Probiotic Rice Cereal, Banana Apple, 8 oz (227 g)",Gerber," Probiotic Rice Cereal, Banana Apple,", Breakfast,227 g,8.23,4.5,0,2,0,3,14,19,excellent
89993,"Lakanto, Low-Carb Pancake & Waffle Mix, 1 lb (454 g)",Lakanto," Low-Carb Pancake & Waffle Mix,", Breakfast,454 g,19.71,3.9,1,1,1,0,5,8,good
35680,"Bob's Red Mill, Granola, Apple Blueberry, 12 oz (340 g)",Bob's Red Mill," Granola, Apple Blueberry,", Breakfast,340 g,8.8,4.1,4,7,20,42,64,137,excellent
